{
  "$schema": "./fast.ejs.schema.json",
  "build": {
    "interval": 100,
    "output": "build",
    "useIndexRouting": true
  },
  "components": {
    "dir": "components"
  },
  "data": {
    "allow": "all",
    "dir": "data"
  },
  "pages": {
    "dir": "pages"
  },
  "tailwind": {
    "imports": [],
    "output": "public/app.css"
  }
}
